{
 "batch_id": "batch-text-20261023-161418-r2",
 "purpose": "text_design_scan",
 "category": "高空作业车",
 "models": [],
 "profile_ref": null,
 "profile_status": "missing",
 "queries": {
  "industry": [
   "工程机械 工业设计",
   "特种车辆 外观 设计 解读",
   "商用车 CMF 色彩 材质 趋势",
   "作业车 造型 设计"
  ],
  "review": [
   "高空作业车 驾驶室 设计",
   "专用车 造型 设计"
  ],
  "academic": [
   "高空作业车 工业设计 研究",
   "工程机械 造型设计 研究"
  ]
 },
 "quota": {
  "industry": 3,
  "review": 2,
  "academic": 2
 },
 "negative_terms": [
  "油耗",
  "马力",
  "配置",
  "报价",
  "优惠",
  "试驾",
  "保养",
  "维修",
  "参数",
  "经销商",
  "促销",
  "扭矩",
  "变速箱",
  "发动机",
  "裸车价",
  "促销价",
  "询价"
 ],
 "relevant_terms": [
  "高空作业车",
  "工程机械",
  "商用车",
  "工程车辆",
  "驾驶室"
 ],
 "skip_domains": [
  "docin.com",
  "baike.baidu.com",
  "b2b.baidu.com"
 ],
 "budget": {
  "max_queries": 10,
  "max_fetch": 10,
  "max_rounds": 2
 },
 "round": 2,
 "fallback": [
  "generic_layer",
  "switch_sources",
  "propose_profile"
 ]
}