{
 "batch_id": "batch-text-20261023-160832",
 "purpose": "text_design_scan",
 "category": "随车吊",
 "models": [],
 "profile_ref": "随车吊",
 "profile_status": "draft",
 "queries": {
  "industry": [
   "随车吊 造型 设计 语言",
   "随车起重运输车 造型 设计 语言",
   "专用车 造型 设计 趋势",
   "工程运输 造型 设计 趋势",
   "工程机械 造型 设计",
   "工程车辆 外观 设计 解读",
   "随车吊 造型 设计 解读"
  ],
  "review": [
   "随车吊 吊臂 设计",
   "随车吊 支腿 设计",
   "随车吊 货厢 设计"
  ]
 },
 "quota": {
  "industry": 3,
  "review": 3
 },
 "negative_terms": [
  "油耗",
  "马力",
  "配置",
  "报价",
  "优惠",
  "试驾",
  "保养",
  "维修",
  "参数",
  "经销商",
  "促销",
  "扭矩",
  "变速箱",
  "发动机",
  "裸车价",
  "促销价",
  "询价"
 ],
 "relevant_terms": [
  "随车吊",
  "随车起重运输车",
  "汽车起重运输车",
  "随车起重机",
  "吊臂",
  "支腿",
  "货厢",
  "转台",
  "驾驶室",
  "工程机械",
  "商用车",
  "工程车辆"
 ],
 "skip_domains": [
  "docin.com",
  "baike.baidu.com",
  "b2b.baidu.com"
 ],
 "budget": {
  "max_queries": 10,
  "max_fetch": 10,
  "max_rounds": 2
 },
 "round": 1,
 "fallback": [
  "generic_layer",
  "switch_sources",
  "propose_profile"
 ]
}